{
  "schema_version": "datapan.source-reference-drift.v1",
  "generated_at": "2026-10-10T20:52:58Z",
  "datapan_version": "v0.1.29",
  "source_inputs": [
    {
      "path": "sources/data_go_kr.json",
      "source_id": "data_go_kr",
      "provider": "data.go.kr",
      "bytes": 2819,
      "sha256": "ab6f6b24f7556e16deac864ad0b349021023ef40a374f3555ca54e37c22ccbc6"
    },
    {
      "path": "sources/ecos.json",
      "source_id": "ecos",
      "provider": "ECOS",
      "bytes": 3292,
      "sha256": "2f4202ee24201e821666cdc7c55b724e979d94024b3f8289120e6c39c6584750"
    },
    {
      "path": "sources/kosis.json",
      "source_id": "kosis",
      "provider": "KOSIS",
      "bytes": 2964,
      "sha256": "b24be7097c06f73f0ce72b7a171316e97d3077059434d853738bf1633dd17c50"
    },
    {
      "path": "sources/open_assembly.json",
      "source_id": "open_assembly",
      "provider": "open.assembly.go.kr",
      "bytes": 2923,
      "sha256": "f8459b47e6642d5350377ca8f3e6608021808614602de48e2cb6090525e1aaae"
    },
    {
      "path": "sources/seoul_open_data.json",
      "source_id": "seoul_open_data",
      "provider": "data.seoul.go.kr",
      "bytes": 3432,
      "sha256": "9ae73b337e2fd44e667087f50f538d123fe00e90afd03ab221e6b90fc9aef7a8"
    }
  ],
  "summary": {
    "sources": 5,
    "references": 18,
    "manual_review_references": 17,
    "network_checked_references": 0,
    "changed_references": 1,
    "missing_references": 0,
    "contract_affecting_changes": 1
  },
  "sources": [
    {
      "source_id": "data_go_kr",
      "provider": "data.go.kr",
      "source_profile": "sources/data_go_kr.json",
      "last_reviewed_at": "2026-06-29",
      "references": [
        {
          "kind": "homepage_url",
          "url": "https://www.data.go.kr/",
          "reviewed_at": "2026-06-29",
          "check_mode": "manual_review",
          "drift_status": "baseline",
          "contract_impact": [
            "source_identity"
          ]
        },
        {
          "kind": "api_docs_url",
          "url": "https://www.data.go.kr/ugs/selectPublicDataUseGuideView.do",
          "reviewed_at": "2026-06-29",
          "check_mode": "manual_review",
          "drift_status": "baseline",
          "contract_impact": [
            "catalogue",
            "auth",
            "runtime"
          ]
        },
        {
          "kind": "key_request_url",
          "url": "https://www.data.go.kr/ugs/selectPublicDataUseGuideView.do",
          "reviewed_at": "2026-06-29",
          "check_mode": "manual_review",
          "drift_status": "baseline",
          "contract_impact": [
            "auth"
          ]
        },
        {
          "kind": "notice_url",
          "url": "https://www.data.go.kr/bbs/ntc/selectNoticeListView.do",
          "reviewed_at": "2026-06-29",
          "check_mode": "manual_review",
          "drift_status": "baseline",
          "contract_impact": [
            "notice",
            "runtime"
          ]
        }
      ],
      "notes": "Manual baseline only; no live network drift check is performed by this report."
    },
    {
      "source_id": "ecos",
      "provider": "ECOS",
      "source_profile": "sources/ecos.json",
      "last_reviewed_at": "2026-06-30",
      "references": [
        {
          "kind": "homepage_url",
          "url": "https://ecos.bok.or.kr/api/",
          "reviewed_at": "2026-06-30",
          "check_mode": "manual_review",
          "drift_status": "baseline",
          "contract_impact": [
            "source_identity"
          ]
        },
        {
          "kind": "api_docs_url",
          "url": "https://ecos.bok.or.kr/api/#/",
          "reviewed_at": "2026-06-30",
          "check_mode": "manual_review",
          "drift_status": "baseline",
          "contract_impact": [
            "catalogue",
            "auth",
            "runtime"
          ]
        },
        {
          "kind": "key_request_url",
          "url": "https://ecos.bok.or.kr/api/#/AuthKeyApply",
          "reviewed_at": "2026-06-30",
          "check_mode": "manual_review",
          "drift_status": "baseline",
          "contract_impact": [
            "auth"
          ]
        }
      ],
      "notes": "Manual baseline only; ECOS error taxonomy was reviewed from official RESULT.CODE/RESULT.MESSAGE responses, and runtime verification is a separate future task."
    },
    {
      "source_id": "kosis",
      "provider": "KOSIS",
      "source_profile": "sources/kosis.json",
      "last_reviewed_at": "2026-06-29",
      "references": [
        {
          "kind": "homepage_url",
          "url": "https://kosis.kr/openapi/index/index.jsp",
          "reviewed_at": "2026-06-29",
          "check_mode": "manual_review",
          "drift_status": "baseline",
          "contract_impact": [
            "source_identity"
          ]
        },
        {
          "kind": "api_docs_url",
          "url": "https://kosis.kr/openapi/devGuide/devGuide_0201List.do",
          "reviewed_at": "2026-06-29",
          "check_mode": "not_checked",
          "drift_status": "changed",
          "contract_impact": [
            "catalogue",
            "auth",
            "runtime"
          ]
        },
        {
          "kind": "key_request_url",
          "url": "https://kosis.kr/openapi/index/index.jsp",
          "reviewed_at": "2026-06-29",
          "check_mode": "manual_review",
          "drift_status": "baseline",
          "contract_impact": [
            "auth"
          ]
        }
      ],
      "notes": "Manual baseline only; KOSIS runtime verification is a separate future task. The API documentation reference changed in Registry source profile commit 56a2e34; the current reference is recorded without asserting a new manual or network review. The reviewed_at date remains the historical source-profile value."
    },
    {
      "source_id": "open_assembly",
      "provider": "open.assembly.go.kr",
      "source_profile": "sources/open_assembly.json",
      "last_reviewed_at": "2026-06-30",
      "references": [
        {
          "kind": "homepage_url",
          "url": "https://open.assembly.go.kr/portal/mainPage.do",
          "reviewed_at": "2026-06-30",
          "check_mode": "manual_review",
          "drift_status": "baseline",
          "contract_impact": [
            "source_identity"
          ]
        },
        {
          "kind": "api_docs_url",
          "url": "https://open.assembly.go.kr/portal/openapi/main.do",
          "reviewed_at": "2026-06-30",
          "check_mode": "manual_review",
          "drift_status": "baseline",
          "contract_impact": [
            "catalogue",
            "auth",
            "runtime"
          ]
        },
        {
          "kind": "key_request_url",
          "url": "https://open.assembly.go.kr/portal/mainPage.do",
          "reviewed_at": "2026-06-30",
          "check_mode": "manual_review",
          "drift_status": "baseline",
          "contract_impact": [
            "auth"
          ]
        }
      ],
      "notes": "Manual baseline only; Open Assembly error taxonomy was reviewed from official RESULT.CODE/RESULT.MESSAGE responses, and runtime verification is a separate future task."
    },
    {
      "source_id": "seoul_open_data",
      "provider": "data.seoul.go.kr",
      "source_profile": "sources/seoul_open_data.json",
      "last_reviewed_at": "2026-06-29",
      "references": [
        {
          "kind": "homepage_url",
          "url": "https://data.seoul.go.kr/",
          "reviewed_at": "2026-06-29",
          "check_mode": "manual_review",
          "drift_status": "baseline",
          "contract_impact": [
            "source_identity"
          ]
        },
        {
          "kind": "api_docs_url",
          "url": "https://data.seoul.go.kr/together/guide/useGuide.do",
          "reviewed_at": "2026-06-29",
          "check_mode": "manual_review",
          "drift_status": "baseline",
          "contract_impact": [
            "catalogue",
            "auth",
            "runtime"
          ]
        },
        {
          "kind": "key_request_url",
          "url": "https://data.seoul.go.kr/together/guide/useGuide.do",
          "reviewed_at": "2026-06-29",
          "check_mode": "manual_review",
          "drift_status": "baseline",
          "contract_impact": [
            "auth"
          ]
        },
        {
          "kind": "notice_url",
          "url": "https://data.seoul.go.kr/together/notice/boardList.do",
          "reviewed_at": "2026-06-29",
          "check_mode": "manual_review",
          "drift_status": "baseline",
          "contract_impact": [
            "notice",
            "runtime"
          ]
        },
        {
          "kind": "terms_url",
          "url": "https://data.seoul.go.kr/etc/accessTerms.do",
          "reviewed_at": "2026-06-29",
          "check_mode": "manual_review",
          "drift_status": "baseline",
          "contract_impact": [
            "terms"
          ]
        }
      ],
      "notes": "Manual baseline only; Seoul Open Data runtime verification is a separate future task."
    }
  ]
}
